{
  "contractVersion": "1",
  "workerId": "relay-mini-1",
  "implementationRevision": "relay-worker@2026.10.05",
  "supportedContractVersions": ["1"],
  "supportedKinds": ["city-source-discovery", "city-curation-refresh", "carousel-export", "carousel-compose"],
  "capabilities": {
    "firecrawl": true,
    "nativeProviders": ["luma", "partiful"],
    "executionModes": ["artifact-only", "direct-database-dev"],
    "editorialComposition": {
      "carouselCompose": true,
      "providers": ["claude-cli", "codex-cli"],
      "structuredOutput": true,
      "imageReview": true,
      "subscriptionOnly": true
    }
  },
  "advertisedAt": "2026-10-05T05:55:00.000Z"
}
